[
  {
    "id": "a1",
    "serial": "…7B42",
    "dev": "Shooter L",
    "severity": "high",
    "method": "SIBLING",
    "state": "new",
    "firstSeen": "2026 · DIST 2 M7",
    "title": "Heats 41% faster than Shooter R at the same load, and the gap is widening.",
    "metric": "°C of temperature rise per 100 A·s of work",
    "unit": "°C / 100 A·s",
    "actual": "2.4",
    "expected": "1.6 – 1.8",
    "matchesAffected": 24,
    "confidence": "high",
    "evidence": {
      "range": [
        1,
        3
      ],
      "band": [
        1.6,
        1.8
      ],
      "values": [
        1.72,
        1.72,
        1.69,
        1.72,
        1.68,
        1.68,
        1.7,
        1.72,
        1.73,
        1.76,
        1.81,
        1.82,
        1.82,
        1.87,
        1.88,
        1.92,
        1.91,
        1.96,
        1.96,
        1.96,
        2,
        2.01,
        2.03,
        2.04,
        2.05,
        2.13,
        2.09,
        2.16,
        2.14,
        2.21,
        2.23,
        2.23,
        2.27,
        2.26,
        2.3,
        2.34,
        2.3,
        2.36,
        2.36,
        2.41
      ],
      "peer": [
        1.72,
        1.72,
        1.71,
        1.7,
        1.7,
        1.68,
        1.69,
        1.68,
        1.68,
        1.69,
        1.68,
        1.68,
        1.72,
        1.7,
        1.7,
        1.69,
        1.69,
        1.69,
        1.69,
        1.68,
        1.69,
        1.68,
        1.7,
        1.68,
        1.7,
        1.72,
        1.71,
        1.72,
        1.71,
        1.7,
        1.72,
        1.72,
        1.7,
        1.7,
        1.68,
        1.69,
        1.7,
        1.7,
        1.69,
        1.72
      ],
      "peerName": "Shooter R",
      "xFrom": "2026 · DIST 2 M1",
      "xTo": "2026 · OFF M8"
    },
    "why": "Both shooters get the same commands, so they should heat at the same rate. Since its seventh match, Shooter L has heated faster per unit of work than Shooter R every match, and the difference keeps growing.",
    "causes": [
      "Belt over-tensioned on the left side",
      "Dragging bearing or rubbing flywheel",
      "Motor wearing out early"
    ],
    "similar": "The motor this one replaced (SN …19D0) showed the same climb for nine matches before it was retired with bearing noise. If the cause is in the mount or belt path rather than the motor, a new motor will not fix it.",
    "resolution": null,
    "history": []
  },
  {
    "id": "a4",
    "serial": "…0EC8",
    "dev": "Indexer",
    "severity": "high",
    "method": "STEP",
    "state": "new",
    "firstSeen": "2026 · DCMP M12",
    "title": "Current-limit hits jumped from almost none to 1.4 per match after District Champs Qual 12.",
    "metric": "stator current-limit events per match",
    "unit": "/ match",
    "actual": "1.4",
    "expected": "≤ 0.2",
    "matchesAffected": 12,
    "confidence": "high",
    "evidence": {
      "range": [
        0,
        3
      ],
      "band": [
        0,
        0.2
      ],
      "values": [
        0,
        0,
        0,
        0,
        0,
        0,
        0,
        0,
        0,
        0,
        0,
        0,
        0,
        0,
        0,
        0,
        0.3,
        0,
        0,
        0,
        1.25,
        1.09,
        1.8,
        1.79,
        1.7,
        1.42,
        1.29,
        1.36,
        1.16,
        1.13,
        1.36,
        1.11,
        1.63,
        1.22,
        1.41,
        1.16,
        1.18,
        1.24,
        1.38,
        1.68
      ],
      "peer": null,
      "peerName": null,
      "xFrom": "2026 · DIST 2 M10",
      "xTo": "2026 · OFF M8"
    },
    "why": "This is a sudden change, not a slow drift. Something happened around Qual 12, and every match since has had at least one jam-like current spike. Before that, the indexer went whole events without one.",
    "causes": [
      "A mechanical change or hit around Q12: check the pit log for that day",
      "A belt or roller slipping since then",
      "Worn game pieces jamming more often"
    ],
    "similar": null,
    "resolution": null,
    "history": []
  },
  {
    "id": "a2",
    "serial": "…3B44",
    "dev": "Drive BR",
    "severity": "med",
    "method": "DRIFT",
    "state": "investigating",
    "firstSeen": "2026 · DCMP M4",
    "title": "Spin-test current up 31% since District Champs. The other three modules stayed flat.",
    "metric": "pit spin-test current, amps at 50% duty",
    "unit": "A",
    "actual": "2.72 A",
    "expected": "2.0 – 2.2 A",
    "matchesAffected": 24,
    "confidence": "med",
    "evidence": {
      "range": [
        1.6,
        3
      ],
      "band": [
        2,
        2.2
      ],
      "values": [
        2.12,
        2.09,
        2.08,
        2.1,
        2.09,
        2.08,
        2.1,
        2.1,
        2.11,
        2.09,
        2.08,
        2.12,
        2.12,
        2.12,
        2.11,
        2.14,
        2.15,
        2.16,
        2.18,
        2.24,
        2.26,
        2.26,
        2.3,
        2.34,
        2.32,
        2.37,
        2.4,
        2.41,
        2.45,
        2.44,
        2.48,
        2.49,
        2.52,
        2.56,
        2.6,
        2.61,
        2.62,
        2.65,
        2.68,
        2.71
      ],
      "peer": [
        2.07,
        2.06,
        2.07,
        2.07,
        2.05,
        2.05,
        2.05,
        2.05,
        2.06,
        2.07,
        2.06,
        2.04,
        2.07,
        2.07,
        2.05,
        2.04,
        2.06,
        2.06,
        2.06,
        2.06,
        2.08,
        2.07,
        2.06,
        2.08,
        2.05,
        2.04,
        2.05,
        2.07,
        2.06,
        2.07,
        2.08,
        2.07,
        2.07,
        2.08,
        2.08,
        2.06,
        2.05,
        2.05,
        2.08,
        2.07
      ],
      "peerName": "Drive FL / FR / BL average",
      "xFrom": "2026 · DIST 2 M1",
      "xTo": "2026 · OFF M8"
    },
    "why": "The weekly spin test runs every module at the same duty cycle with the robot on blocks, so friction shows up as extra current. Drive BR has climbed steadily since District Champs while its three siblings did not move, which points to that one module.",
    "causes": [
      "Wheel bearing wear",
      "Debris or carpet fiber in the gear mesh",
      "A bent bevel gear or misaligned module"
    ],
    "similar": "Drive FL showed the same drift in 2025. A new wheel bearing put it back in band within one event, and it has stayed there for two robots.",
    "resolution": null,
    "history": []
  },
  {
    "id": "a3",
    "serial": "B03",
    "dev": "Battery B03",
    "severity": "med",
    "method": "SPEC",
    "state": "new",
    "firstSeen": "2026 · DIST 2 M4",
    "title": "Internal resistance is 19 mΩ, past the 15 mΩ match spec, and rising about 0.065 mΩ per cycle.",
    "metric": "internal resistance before each match, mΩ",
    "unit": "mΩ",
    "actual": "19.2 mΩ",
    "expected": "≤ 15 mΩ",
    "matchesAffected": 30,
    "confidence": "high",
    "evidence": {
      "range": [
        8,
        24
      ],
      "band": [
        8,
        15
      ],
      "values": [
        15.1,
        15.24,
        15.2,
        15.21,
        15.46,
        15.63,
        15.68,
        15.67,
        15.94,
        15.88,
        16.09,
        16.19,
        16.12,
        16.46,
        16.59,
        16.61,
        16.75,
        16.92,
        17.01,
        17.08,
        17.07,
        17.08,
        17.23,
        17.48,
        17.5,
        17.67,
        17.72,
        17.69,
        17.85,
        17.9,
        18.11,
        18.24,
        18.51,
        18.44,
        18.6,
        18.72,
        18.64,
        18.77,
        19.14,
        19.08
      ],
      "peer": null,
      "peerName": null,
      "xFrom": "2026 · DIST 1 M1",
      "xTo": "2026 · OFF M8"
    },
    "why": "This battery has aged steadily all season. It passed the 15 mΩ match spec mid-season and, at its current rate, reaches the 20 mΩ retirement line in roughly 12 more cycles. Higher resistance means deeper voltage sag under the same load.",
    "causes": [
      "Normal aging for a battery with 90+ cycles",
      "Deep discharges at events speed it up"
    ],
    "similar": "B07 followed the same curve a year earlier and is now practice-only.",
    "resolution": null,
    "history": []
  },
  {
    "id": "a5",
    "serial": "…5C11",
    "dev": "Intake",
    "severity": "low",
    "method": "NOISE",
    "state": "new",
    "firstSeen": "2026 · OFF M4",
    "title": "Idle current is three times noisier than usual while the intake is commanded off.",
    "metric": "standard deviation of current at idle, amps",
    "unit": "A",
    "actual": "0.9 A",
    "expected": "≤ 0.3 A",
    "matchesAffected": 5,
    "confidence": "low",
    "evidence": {
      "range": [
        0,
        1.4
      ],
      "band": [
        0,
        0.3
      ],
      "values": [
        0.23,
        0.19,
        0.18,
        0.19,
        0.21,
        0.23,
        0.21,
        0.23,
        0.24,
        0.19,
        0.23,
        0.22,
        0.24,
        0.19,
        0.19,
        0.18,
        0.19,
        0.23,
        0.23,
        0.24,
        0.22,
        0.19,
        0.23,
        0.18,
        0.19,
        0.23,
        0.19,
        0.23,
        0.22,
        0.21,
        0.21,
        0.22,
        0.23,
        0.18,
        1.05,
        0.93,
        0.85,
        0.89,
        0.9,
        0.96
      ],
      "peer": null,
      "peerName": null,
      "xFrom": "2026 · DCMP M1",
      "xTo": "2026 · OFF M8"
    },
    "why": "A motor that is commanded off should draw flat current. Short spikes at idle usually mean an intermittent electrical connection rather than a mechanical problem. Only five matches so far, so confidence is low.",
    "causes": [
      "Loose power lug or connector",